{
  "schema_version": "2.0",
  "status": "draft",
  "book_id": "breakthrough-advertising-dev",
  "title": "Breakthrough Advertising / 突破性广告",
  "domain": "direct-response advertising, copywriting, and market persuasion",
  "source": {
    "document_sha256": "e077e6b8467b30b9499a48021a0b360f87c43a2442a0d3a42d420efd74274a3c",
    "locator_scheme": "BA-<sha12>-<chapter>-src-<kind>-L<start>-L<end>",
    "notes": "所有定位都使用这一份哈希绑定源文件的绝对行空间；src 不表示任何语言具有主锚地位。双语部分只是在本书开发中可互校的两个文本见证，其他书按各自经人工确认的可靠来源定位。当前多数工作锚位于英文半部，是 OCR 清晰度与术语核对的临时工程选择，不构成跨书评分规则；高权重关系冻结前仍须与中文对应段及可靠原版复核。"
  },
  "compression": {
    "min_chars": 6000,
    "max_chars": 8000
  },
  "source_anchors": [
    {
      "id": "SA-001",
      "locator": "BA-e077e6b8467b-FRONT-src-analysis-L4855-L4871",
      "chapter": "Introduction",
      "section": "Analysis rather than formulas",
      "evidence_summary": "作者把每个新市场、产品和广告视为独特问题；过去公式是过去问题的解，分析才让当前问题决定答案。",
      "argument_function": "建立反公式的上位认识论与分析方法。"
    },
    {
      "id": "SA-002",
      "locator": "BA-e077e6b8467b-C05-src-creativity-L6294-L6324",
      "chapter": "Chapter 5",
      "section": "The Three Levels of Creativity",
      "evidence_summary": "作者区分替词模仿、仅用于 verbalization 的公式，以及从产品—市场—时机关系中寻找独特解法的分析。",
      "argument_function": "限定公式的合法用途并反驳用历史模板生成创意。"
    },
    {
      "id": "SA-003",
      "locator": "BA-e077e6b8467b-C05-src-summary-L6398-L6434",
      "chapter": "Chapter 5",
      "section": "Summary: The Art of Creative Planning",
      "evidence_summary": "市场分析与产品分析汇合为 theme，再由 Awareness 与 Sophistication 找到 headline entry，正文随后建立 conviction。",
      "argument_function": "给出第一部总路径并连接标题与正文。"
    },
    {
      "id": "SA-004",
      "locator": "BA-e077e6b8467b-C01-src-mass-desire-L5104-L5134",
      "chapter": "Chapter 1",
      "section": "Mass Desire",
      "evidence_summary": "大众欲望由市场中的社会、经济和技术力量长期形成；文案不能创造或对抗，只能导向特定产品。",
      "argument_function": "建立大众欲望的因果来源、广告边界与导流职责。"
    },
    {
      "id": "SA-005",
      "locator": "BA-e077e6b8467b-C01-src-channel-desire-L5160-L5180",
      "chapter": "Chapter 1",
      "section": "How to Channel Mass Desire",
      "evidence_summary": "作者以 urgency、staying power、scope 比较欲望，只让一个主导欲望通过标题连接产品。",
      "argument_function": "给出主导欲望选择机制与标题桥梁。"
    },
    {
      "id": "SA-006",
      "locator": "BA-e077e6b8467b-C01-src-product-analysis-L5188-L5214",
      "chapter": "Chapter 1",
      "section": "The Analysis of Your Product",
      "evidence_summary": "产品分为物理产品与功能产品；物理事实从属于功能表现，用来证明、强化或赋予可信基础。",
      "argument_function": "建立物理事实与功能性销售承诺的从属关系。"
    },
    {
      "id": "SA-007",
      "locator": "BA-e077e6b8467b-C01-src-dominant-performance-L5218-L5250",
      "chapter": "Chapter 1",
      "section": "Dominant performance",
      "evidence_summary": "一个产品有多项表现，但广告一次只能突出最能接入主导欲望的一项；其余表现只支持主诉求。",
      "argument_function": "建立单一主导 performance 及其他材料的支持角色。"
    },
    {
      "id": "SA-008",
      "locator": "BA-e077e6b8467b-C02-src-three-questions-L5266-L5298",
      "chapter": "Chapter 2",
      "section": "Headline's real job",
      "evidence_summary": "Mass Desire、Awareness 与 Sophistication 三问共同决定标题内容；标题通常只负责让读者继续读下一句。",
      "argument_function": "建立标题诊断输入、真实职责与最知情特价例外。"
    },
    {
      "id": "SA-009",
      "locator": "BA-e077e6b8467b-C02-src-aware-branches-L5404-L5456",
      "chapter": "Chapter 2",
      "section": "New products and need-solving products",
      "evidence_summary": "已知结果但不知产品时，从欲望或方案进入并证明机制；已知需要但未连接产品时，从需要进入并把产品呈为必然方案。",
      "argument_function": "支撑 Awareness 中段的条件分支。"
    },
    {
      "id": "SA-010",
      "locator": "BA-e077e6b8467b-C02-src-unaware-L5492-L5534",
      "chapter": "Chapter 2",
      "section": "Completely Unaware Market",
      "evidence_summary": "完全不知情或抗拒的市场不能从价格、产品、功能或欲望直入，而要以市场身份开头，逐步走到问题、方案和产品。",
      "argument_function": "建立 Awareness 第五阶段的排除规则与渐进路径。"
    },
    {
      "id": "SA-011",
      "locator": "BA-e077e6b8467b-C03-src-sophistication-1-2-L5776-L5854",
      "chapter": "Chapter 3",
      "section": "Sophistication stages 1–2",
      "evidence_summary": "无同类信息时直接陈述需要或主张；竞争出现且直接主张仍有效时扩大主张，直到可信度耗竭。",
      "argument_function": "建立 Sophistication 前两阶段及其转移条件。"
    },
    {
      "id": "SA-012",
      "locator": "BA-e077e6b8467b-C03-src-sophistication-3-5-L5856-L5944",
      "chapter": "Chapter 3",
      "section": "Sophistication stages 3–5",
      "evidence_summary": "旧主张饱和后机制进入标题、主张后置；机制也耗竭后转向 prospect identification。",
      "argument_function": "建立 what→how 换位、机制扩张和第五阶段转向。"
    },
    {
      "id": "SA-013",
      "locator": "BA-e077e6b8467b-C06-src-three-dimensions-L6442-L6508",
      "chapter": "Chapter 6",
      "section": "Desires, Identifications, Beliefs",
      "evidence_summary": "标题带来注意，正文通过 Desire、Identification、Belief 三维改变读者现实图景并把产品建成主导欲望的实现。",
      "argument_function": "连接标题与正文，定义三维心智及整体编织目标。"
    },
    {
      "id": "SA-014",
      "locator": "BA-e077e6b8467b-C07-src-intensification-L6512-L6556",
      "chapter": "Chapter 7",
      "section": "Intensification",
      "evidence_summary": "把模糊欲望变成连续而不同的具体满足图景；不可复述同一表述，但可用新视角强化同一承诺。",
      "argument_function": "定义 Intensification 并给出新鲜性、篇幅和市场饱和边界。"
    },
    {
      "id": "SA-015",
      "locator": "BA-e077e6b8467b-C08-src-identification-L7010-L7150",
      "chapter": "Chapter 8",
      "section": "Identification and desired roles",
      "evidence_summary": "产品既满足功能需要，也可成为角色的实现工具或已实现角色的社会符号；角色分 character 与 achievement。",
      "argument_function": "定义 Identification、双重购买理由和角色分类。"
    },
    {
      "id": "SA-016",
      "locator": "BA-e077e6b8467b-C08-src-primary-image-L7178-L7246",
      "chapter": "Chapter 8",
      "section": "Primary Image",
      "evidence_summary": "既有 primary image 不能被丢弃或直接反驳；不利形象须保留、降强度并作为通向有利形象的逻辑桥。",
      "argument_function": "建立形象转换的事实边界与 Chesterfield 例的完整桥接功能。"
    },
    {
      "id": "SA-017",
      "locator": "BA-e077e6b8467b-C08-src-image-limits-L7286-L7308",
      "chapter": "Chapter 8",
      "section": "Limits to Identification Images",
      "evidence_summary": "受众若不相信产品具备目标特质或无法与自身连接，就必须从已接受形象建立 believability bridge；要求跨越鸿沟会失败。",
      "argument_function": "限定目标形象的可接受性并定义桥接失败。"
    },
    {
      "id": "SA-018",
      "locator": "BA-e077e6b8467b-C09-src-gradualization-L7354-L7420",
      "chapter": "Chapter 9",
      "section": "Belief and Gradualization",
      "evidence_summary": "Desire 与 Identification 必须同 Belief 融合为 conviction；Gradualization 从已接受事实逐步延伸到原本不接受的结论。",
      "argument_function": "建立 belief 边界、接受链及其与 proof/documentation 的区分。"
    },
    {
      "id": "SA-019",
      "locator": "BA-e077e6b8467b-C09-src-belief-architecture-L7430-L7470",
      "chapter": "Chapter 9",
      "section": "The Architecture of Belief",
      "evidence_summary": "陈述力量同时来自内容和前置准备；位置与顺序可提高接受度，Awareness 可重述为 readiness to accept。",
      "argument_function": "说明结构、位置和准备如何改变同一主张的可信力。"
    },
    {
      "id": "SA-020",
      "locator": "BA-e077e6b8467b-C09-src-tv-case-L7472-L7630",
      "chapter": "Chapter 9",
      "section": "TV Repair Manual case",
      "evidence_summary": "案例从共同怨气与连续 agreement，推进到电视可靠、普通人可做 minor adjustments，再推出应获得知识并节省维修费。",
      "argument_function": "构成性演示完整 Gradualization 接受链。"
    },
    {
      "id": "SA-021",
      "locator": "BA-e077e6b8467b-C09-src-restatement-L7634-L7652",
      "chapter": "Chapter 9",
      "section": "Restatement of the Theory",
      "evidence_summary": "目标结论在读者准备好后再出现；逐层 agreement 和 believability structure 比堆叠未被相信的承诺更有力。",
      "argument_function": "从 TV 案例抽象出延迟结论和结构性接受原则。"
    },
    {
      "id": "SA-022",
      "locator": "BA-e077e6b8467b-C10-src-redefinition-L7806-L7846",
      "chapter": "Chapter 10",
      "section": "Redefinition and Lifebuoy",
      "evidence_summary": "Redefinition 为内置阻力提供新的解释而非否认事实；Lifebuoy 将不可移除的药味转成清洁力的感官证明。",
      "argument_function": "定义视角重排并提供 liability→asset 构成性案例。"
    },
    {
      "id": "SA-023",
      "locator": "BA-e077e6b8467b-C10-src-tv-simplification-L7850-L7910",
      "chapter": "Chapter 10",
      "section": "Simplification",
      "evidence_summary": "TV 案例把 repair 重定义为常见、外部、轻微的 adjustments，同时保留少数真正 major breakdowns。",
      "argument_function": "演示 simplification 不靠空喊简单，而靠事实分类和词义重组。"
    },
    {
      "id": "SA-024",
      "locator": "BA-e077e6b8467b-C10-src-three-redefinitions-L7912-L8008",
      "chapter": "Chapter 10",
      "section": "Simplification, Escalation, Price Reduction",
      "evidence_summary": "复杂阻力对应简化，吸引面过窄对应扩大产品角色，高价对应切换到更高的比较标准。",
      "argument_function": "建立三类阻力与三种 Redefinition 的条件映射。"
    },
    {
      "id": "SA-025",
      "locator": "BA-e077e6b8467b-C10-src-structure-perspective-L8046-L8048",
      "chapter": "Chapter 10",
      "section": "Gradualization versus Redefinition",
      "evidence_summary": "Gradualization 通过事实与短语的安排工作，Redefinition 通过视角重排工作；二者都建立 belief。",
      "argument_function": "防止把两种相邻机制混为同义词。"
    },
    {
      "id": "SA-026",
      "locator": "BA-e077e6b8467b-C11-src-mechanism-demand-L8074-L8104",
      "chapter": "Chapter 11",
      "section": "Demand for Mechanism",
      "evidence_summary": "读者会依次要求更多欲望材料、proof 或 how-it-works；Mechanization 用语言与逻辑回答如何兑现结果。",
      "argument_function": "定义机制需求、切换点和 verbal proof。"
    },
    {
      "id": "SA-027",
      "locator": "BA-e077e6b8467b-C11-src-mechanism-stages-L8106-L8204",
      "chapter": "Chapter 11",
      "section": "Name, Describe, Feature the Mechanism",
      "evidence_summary": "机制已知时只命名，未知或同质时销售性描述，市场高度成熟或机制强时让机制成为 headline claim。",
      "argument_function": "建立机制呈现强度的条件分支和次级主张支持主承诺的关系。"
    },
    {
      "id": "SA-028",
      "locator": "BA-e077e6b8467b-C12-src-concentration-L8246-L8296",
      "chapter": "Chapter 12",
      "section": "Concentration",
      "evidence_summary": "Concentration 不是单纯攻击，而是证明替代方案的弱点如何损害读者，并证明本品消除该弱点。",
      "argument_function": "建立竞争比较的完整因果桥与 attack-only 失败边界。"
    },
    {
      "id": "SA-029",
      "locator": "BA-e077e6b8467b-C13-src-camouflage-L8450-L8488",
      "chapter": "Chapter 13",
      "section": "Camouflage",